{
  "heading": "A Partnership with Owners",
  "blockquote": "Lasting change comes from consistency, understanding and confidence at home.",
  "body": "<p>Successful behaviour support rarely happens in a single hour. Progress develops through repeated positive experiences and an owner who understands what their dog needs.</p><p>Every consultation is designed to leave you with practical guidance, realistic expectations and a clearer understanding of your dog’s behaviour. You will know what to work on, why it matters and how to continue supporting your dog after the session.</p><p>Our aim is for you to feel informed and empowered rather than overwhelmed.</p>",
  "image_layout": "1-right",
  "images": [
    {
      "url": "https://thepetstudio.local/wp-content/uploads/pet-studio/media/photos/grooming/difficult-dog-stack-2.jpg"
    }
  ]
}
