{
  "heading": "Important to Know",
  "blockquote": "",
  "body": "<p>Behaviour support is not veterinary treatment. Sudden or significant changes in behaviour can be linked to pain or an underlying medical condition, so owners may be advised to speak to their veterinary surgeon before or alongside behavioural support.</p>",
  "image_layout": "1-right",
  "images": [
    {
      "url": "https://thepetstudio.local/wp-content/uploads/pet-studio/media/photos/grooming/difficult-dog-hero.jpg"
    }
  ],
  "section_tone": "muted"
}
