{
  "heading": "North Somerset Training Salon",
  "blockquote": "",
  "body": "<p>Based at our spacious salon in Congresbury, North Somerset, we teach a variety of courses to get you started, or to continue, your dog grooming education. Our salon is equipped with state of the art facilities and fantastic teaching spaces, our hugely experienced and qualified training staff will make your learning experience the best around.</p>",
  "image_layout": "1-right",
  "images": [
    { "url": "https://thepetstudio.local/wp-content/uploads/pet-studio/media/photos/academy/training-salon-side.jpg" }
  ]
}
